### ISSUE TITLE
Bambu SaaS appears unresponsive/blackholed/down.. network test from App passed and local ping -t to status page had 0 drops so not my local lan/wan. Second time this happened in a week since I upgraded. Never had issue before.

### ISSUE THREAD

**Issue by trich101** [bambulab/BambuStudio#8154]
### Bambu Studio Version

2.2.1.60

### Where is the application from?

Bambu Lab Official website

### OS version

Win 10 pro

### Printer

P1S and A1mini

### How to reproduce

Try to print fails at timeout. 
Studio built in Test passed bamblulab, bing, http, and test download plugin. However storage, test storage upgrade and test storage download all fail timeout. I ran ping -t continous to status.bambulab.com 0% loss. Rebooted P1S and tried A1 mini. All fail to print due to timeout to cloud at 30%.

I am a network engineer and tshoot connectivity all the time. I can connect to internet and bambulab while service fails. Service is either not listening, elb to blackholed, or something. Status page says everything is green but obviously not so probaly false positive and may also want to review loadbalancer healthchecks.  

I have had printers for 6 months with no SaaS issues. I upgraded 3 days ago, or so, to 2.2.1.60 and now this is my second failure issue in 3 days.

### Actual results

Timeout on anything neededing SaaS

### Expected results

Expect to connect to server and complete.

### Project file & Debug log uploads

[Bambu Log 11-Sept.txt](https://github.com/user-attachments/files/22284635/Bambu.Log.11-Sept.txt)

C:\Users\User>ping -t status.bambulab.com

Pinging status-bambulab-com-bb7f5263-134f-48a6-9223-106ea80e91e7.saas.atlassian.com [18.238.25.101] with 32 bytes of data:
Reply from 18.238.25.101: bytes=32 time=35ms TTL=243
.
.
.
Ping statistics for 18.238.25.101:
    Packets: Sent = 299, Received = 298, Lost = 1 (0% loss),
Approximate round trip times in milli-seconds:
    Minimum = 16ms, Maximum = 398ms, Average = 37ms
Control-C

### Checklist of files to include

- [x] Log file
- [ ] Project file

**Comment by trich101** [comment]
I even just ran Wireshark during print test and I get traffic, App data, healthly bi-directional traffic so now my local network.

295	28.934910	192.168.1.95	18.238.25.32			TLSv1.2	275	Ignored Unknown Record	17:01:18.278596	0.102048
296	28.935022	192.168.1.95	18.238.25.32			TLSv1.2	93	Application Data	17:01:18.278708	0.000112
300	28.953541	18.238.25.32	192.168.1.95			TCP	54	443 → 5640 [ACK] Seq=1 Ack=262 Win=173 Len=0	17:01:18.297227	0.016059
301	28.953813	18.238.25.32	192.168.1.95			TCP	54	443 → 5640 [ACK] Seq=1 Ack=223 Win=173 Len=0	17:01:18.297499	0.000272
302	28.953813	18.238.25.32	192.168.1.95			TLSv1.2	93	Application Data	17:01:18.297499	0.000000
304	28.979670	18.238.25.32	192.168.1.95			TLSv1.2	957	Application Data	17:01:18.323356	0.021971
305	28.979700	192.168.1.95	18.238.25.32			TCP	54	5640 → 443 [ACK] Seq=262 Ack=943 Win=514 Len=0	17:01:18.323386	0.000030
308	29.583009	192.168.1.95	18.238.25.125			ICMP	74	Echo (ping) request  id=0x0001, seq=339/21249, ttl=128 (reply in 309)	17:01:18.926695	0.599355
309	29.600244	18.238.25.125	192.168.1.95			ICMP	74	Echo (ping) reply    id=0x0001, seq=339/21249, ttl=243 (request in 308)	17:01:18.943930	0.017235
813	73.983813	192.168.1.95	18.238.25.32			TCP	55	[TCP Keep-Alive] 5640 → 443 [ACK] Seq=261 Ack=943 Win=514 Len=1	17:02:03.327499	0.108785
814	74.005782	18.238.25.32	192.168.1.95			TCP	66	[TCP Keep-Alive ACK] 443 → 5640 [ACK] Seq=943 Ack=262 Win=173 Len=0 SLE=261 SRE=262	17:02:03.349468	0.021969
968	88.927094	192.168.1.95	18.238.25.32			TLSv1.2	134	Application Data	17:02:18.270780	0.486219
969	88.927167	192.168.1.95	18.238.25.32			TLSv1.2	93	Application Data	17:02:18.270853	0.000073
972	88.945214	18.238.25.32	192.168.1.95			TCP	54	443 → 5640 [ACK] Seq=943 Ack=342 Win=173 Len=0	17:02:18.288900	0.010320
973	88.945214	18.238.25.32	192.168.1.95			TCP	54	443 → 5640 [ACK] Seq=943 Ack=381 Win=173 Len=0	17:02:18.288900	0.000000
974	88.945214	18.238.25.32	192.168.1.95			TLSv1.2	93	Application Data	17:02:18.288900	0.000000
981	88.970501	18.238.25.32	192.168.1.95			TLSv1.2	957	Application Data	17:02:18.314187	0.015681
982	88.970532	192.168.1.95	18.238.25.32			TCP	54	5640 → 443 [ACK] Seq=381 Ack=1885 Win=510 Len=0	17:02:18.314218	0.000031

**Comment by microSoftware** [comment]
I think i have the same problem

**Comment by JiaYun-Bambu** [comment]
We have contacted the relevant developers to investigate the issue. If possible, please try connecting via the PIN code method as described in the link.
https://wiki.bambulab.com/en/bambu-studio/manual/pin-code.

**Comment by trich101** [comment]
One issue might be the domain doesn't appear to exist. In the self test it attempts a domain that when tested in Google Dig Toolbox doesn't resolve.

Mon Sep 15 01:00:56:test storage upgrade start...
Mon Sep 15 01:00:56:[test_oss_upgrade]: url=http://upgrade-file.bambulab.com
Mon Sep 15 01:00:56:test storage upgrade failed
Mon Sep 15 01:00:56:status=0, body=, error=curl:Couldn't resolve host name:
Could not resolve host: upgrade-file.bambulab.com
[Error 6]
Mon Sep 15 01:01:01:test storage start...
Mon Sep 15 01:01:01:[test_oss]: url=http://upload-file.bambulab.com
Mon Sep 15 01:01:01:test storage failed
Mon Sep 15 01:01:01:status=0, body=, error=curl:Couldn't resolve host name:
Could not resolve host: upload-file.bambulab.com
[Error 6]

Aside from my local lookups failing, a 3rd party external tool like Googles Dig Toolbox cannot resolve it.

upload-file.bambulab.com is "Record not found!"
Same for upgrade-file.bambulab.com/

**Comment by trich101** [comment]
I upgraded today to the new 2.2.2.56 that was released and everything else seems to work aside from the DNS name not resolving for storage.


Mon Sep 15 09:50:49:test storage start...
Mon Sep 15 09:50:49:[test_oss]: url=http://upload-file.bambulab.com
Mon Sep 15 09:50:49:test storage failed
Mon Sep 15 09:50:49:status=0, body=, error=curl:Couldn't resolve host name:
Could not resolve host: upload-file.bambulab.com
[Error 6]
Mon Sep 15 09:50:50:test storage upgrade start...
Mon Sep 15 09:50:50:[test_oss_upgrade]: url=http://upgrade-file.bambulab.com
Mon Sep 15 09:50:50:test storage upgrade failed
Mon Sep 15 09:50:50:status=0, body=, error=curl:Couldn't resolve host name:
Could not resolve host: upgrade-file.bambulab.com
[Error 6]

**Comment by JiaYun-Bambu** [comment]
Could you please upload the logs generated during the process? This will help us further analyze the issue. Thanks.
https://wiki.bambulab.com/en/x1/troubleshooting/bambu-studio-log
